{
  "asset_id": "asset5_commentary",
  "asset_name": "历代注家运气学说数据库",
  "asset_description": "唐代至清代主要医家对五运六气学说的核心贡献与独特见解，涵盖王冰、刘完素、张元素、李东垣、汪石山、张景岳、吴谦、缪问、徐灵胎、张志聪、陆懋修等。每条目包含医家简介、核心理论、经典原文、临床意义。",
  "data_source": "历代运气学专著及医家著作：《素问》王冰注、《素问玄机原病式》、《脏腑标本药式》、《脾胃论》、《运气易览》、《类经图翼》、《医宗金鉴》、《三因司天方》、《医学源流论》、《黄帝内经素问集注》、《世补斋医书》等",
  "entry_count": 20,
  "entries": [
    {
      "commentary_id": "commentary_1",
      "rag_key": "wangbing_qipian_buzhu",
      "author": "王冰",
      "dynasty": "唐代",
      "work": "《次注黄帝内经素问》",
      "chapter": "天元纪大论、五运行大论、六微旨大论、气交变大论、五常政大论、六元正纪大论、至真要大论",
      "core_theory_title": "运气七篇补入与系统整理",
      "core_theory": "王冰（公元710-805年），唐代著名医家，在整理《素问》时，将失传已久的七篇大论（天元纪大论、五运行大论、六微旨大论、气交变大论、五常政大论、六元正纪大论、至真要大论）补入《素问》，使五运六气理论得以完整保存并流传后世。这七篇大论占据了《素问》全书近四分之一的篇幅，系统阐述了五运六气的基本框架，包括十天干化五运、十二地支化六气、司天在泉、客主加临、运气相合、运气太过不及、胜复郁发等核心概念。王冰在次注中不仅对原文进行了逐字逐句的训诂注释，还阐发了运气学说的哲学基础——天人相应整体观，指出运气变化的根本规律是“天地阴阳之气”的对立统一运动。王冰强调“五运更始，上应天期”，将自然气候周期与人体生理病理规律紧密联系起来，为后世运气学说的发展奠定了坚实的文献基础。",
      "classics_quote": "「天元纪大论曰：太虚寥廓，肇基化元，万物资始，五运终天，布气真灵，总统坤元。九星悬朗，七曜周旋，曰阴曰阳，曰柔曰刚，幽显既位，寒暑弛张，生生化化，品物咸章。」——王冰《次注素问》",
      "clinical_significance": "王冰补入运气七篇，使中医运气理论有了完整的文献依据。后世医家据此推算岁运、分析病机、指导用药，形成了中医独特的“时间医学”诊疗模式。至今临床辨证中，结合年干支推算运气格局，仍是中医“天人相应”诊疗思想的重要实践。",
      "related_yunqi_keys": [
        "tiangan_wuyun",
        "dizhi_liuqi",
        "sitian_zaiquan",
        "kezhu_jialin",
        "yunqi_xianghe"
      ]
    },
    {
      "commentary_id": "commentary_2",
      "rag_key": "wangbing_liuqi_shengjiang",
      "author": "王冰",
      "dynasty": "唐代",
      "work": "《次注黄帝内经素问》",
      "chapter": "六微旨大论",
      "core_theory_title": "六气升降出入论",
      "core_theory": "王冰在注释《素问·六微旨大论》时，系统阐述了六气升降出入的运动原理。他指出“气之升降，天地之更用也”，认为天地之气始终处于升降出入的动态平衡之中。升者以天为用，降者以地为用。王冰进一步阐发了“出入废则神机化灭，升降息则气立孤危”的深刻命题，将气机升降视为生命存续的根本条件。在运气规律方面，王冰揭示了一年之中气的升降规律：春气升、夏气浮、秋气降、冬气沉，与六气主时的节奏完全对应。客气流转亦是升降出入的体现——司天主天气之降，在泉主地气之升。王冰的升降理论将天文气象变化与人体气机运行统一起来，认为人体五脏气机的升降出入与天地六气的运行息息相应，为后世“气机升降”学说奠定了理论基础。",
      "classics_quote": "「气之升降，天地之更用也。升已而降，降者谓天；降已而升，升者谓地。天气下降，气流于地；地气上升，气腾于天。故高下相召，升降相因，而变作矣。」——王冰注《素问·六微旨大论》",
      "clinical_significance": "王冰的气机升降理论被后世医家广泛应用于临床。脾胃病治疗中“升清降浊”法则、肺病治疗中“宣发肃降”法则、肝病治疗中“疏泄条达”法则，均源于此。李东垣的补脾升阳法、叶天士的胃阴降逆法，皆是对王冰升降理论的临床发挥。",
      "related_yunqi_keys": [
        "liuqi_shengjiang",
        "qiji_shusheng",
        "tiandi_qi_jiao",
        "zhuqi_liubu"
      ]
    },
    {
      "commentary_id": "commentary_3",
      "rag_key": "liu_wansu_liuqi_huohua",
      "author": "刘完素",
      "dynasty": "金代",
      "work": "《素问玄机原病式》",
      "chapter": "五运主病、六气为病",
      "core_theory_title": "六气皆从火化",
      "core_theory": "刘完素（约1110-1200年），金元四大家之首，河间学派创始人。他在《素问玄机原病式》中创造性地提出“六气皆从火化”的著名命题，将运气病机理论与火热论紧密结合。刘完素认为风、寒、暑、湿、燥、火六气在病理过程中，往往转化为火热证候。其理论逻辑为：风属木，木能生火，故“风火多兼化”；寒为阴邪，郁遏阳气则生内热，故“寒郁化热”；湿邪阻遏气机，郁而化火，故“湿郁化热”；燥邪伤津，津伤则火旺，故“燥从火化”。刘完素还指出六气化火的机制在于“玄府郁闭”——腠理毛孔闭塞，阳气不得宣泄，郁而化火。他将《素问·至真要大论》病机十九条中属火的病证由原来的9种扩展到56种，极大地拓展了火热病证的辨证范围。刘完素据此创制了防风通圣散、双解散等表里双解名方。",
      "classics_quote": "「六气皆从火化。风能胜湿，热能燥湿，寒能收引，湿能伤肉，燥能坚毛，火能灼物。凡诸气者，皆属于火。」——刘完素《素问玄机原病式》",
      "clinical_significance": "刘完素“六气皆从火化”理论直接指导了热性病、温病的辨证论治。防风通圣散至今广泛用于感冒、皮肤病、肥胖等属表里俱实证者。河间学派影响了明清温病学派的形成，吴又可、叶天士、吴鞠通等温病大家均受其启发。临床见六气病证，需考虑化火之机，不可一味散寒祛湿，当兼清透火热。",
      "related_yunqi_keys": [
        "liuqi_bingji",
        "huore_lun",
        "xuanfu_yubi",
        "wenbing_xuepai",
        "feng_han_shu_shi_zao_huo"
      ]
    },
    {
      "commentary_id": "commentary_4",
      "rag_key": "liu_wansu_xuanfu_qiyelun",
      "author": "刘完素",
      "dynasty": "金代",
      "work": "《素问玄机原病式》",
      "chapter": "六气为病·热类",
      "core_theory_title": "玄府气液论",
      "core_theory": "刘完素在运气学说基础上，创造性地提出了“玄府气液论”。玄府原指《内经》中的腠理汗孔，刘完素将其内涵拓展为遍布全身脏腑组织的微观气液通道。他认为玄府是“升降出入”之门户，是气液流通的微观通道。六气致病的关键机制在于“玄府郁闭”——风、寒、暑、湿、燥、火六气侵袭人体，导致玄府闭塞，气液流通受阻，郁而化火。玄府郁闭的程度和部位不同，则病证各异：玄府郁于表则发热恶寒，郁于里则烦热口渴，郁于肺则咳喘，郁于心则烦躁，郁于脾胃则食积不化，郁于肝肾则筋脉拘急。刘完素特别强调，玄府郁闭所致的火热证，治疗当以“开通玄府”为要法，表证当用辛凉开腠，里证当用苦寒泄热通腑，使气液流通则火热自散。",
      "classics_quote": "「玄府者，无物不有，人之脏腑皮毛、肌肉筋膜、骨髓爪牙至于世之万物，尽皆有之。乃气出入升降之门户也。……然玄府闭密，则气液不能通行，故诸病生焉。」——刘完素《素问玄机原病式》",
      "clinical_significance": "玄府气液论将运气病机落实到微观通道层面，为治疗开创了新思路。辛凉解表（如麻黄、石膏配伍）、苦寒通腑（如大黄、芒硝）、芳香开窍（如麝香、冰片）等法，均含“开通玄府”之意。此理论对皮肤病（腠理闭塞）、五官科疾病（玄府不通）、脑病（神窍闭阻）的治疗均有重要指导意义。",
      "related_yunqi_keys": [
        "xuanfu_biming",
        "huore_lun",
        "liuqi_bingji",
        "qiye_liutong",
        "biao_li_shuangjie"
      ]
    },
    {
      "commentary_id": "commentary_5",
      "rag_key": "zhang_yuansu_yunqi_bingyuan",
      "author": "张元素",
      "dynasty": "金代",
      "work": "《医学启源》《脏腑标本药式》",
      "chapter": "五运主病、六气方治",
      "core_theory_title": "运气为病之源——脏腑辨证与运气结合",
      "core_theory": "张元素（约1131-1234年），金元四大家之一，易水学派创始人。他在《医学启源》和《脏腑标本药式》中，创造性地将五运六气理论与脏腑辨证融为一体。张元素认为“运气为病之源，脏腑为病之所”，即运气变化是疾病发生的根本原因，而脏腑则是疾病表现的具体场所。他系统论述了每一年运太过不及对五脏的影响规律，并按照“五脏苦欲补泻”原则制定了相应的治疗方药。张元素的突出贡献在于将抽象的运气推算落实到具体的脏腑用药上。例如：木运太过之年，肝气偏盛，治当泻肝补脾，用芍药、甘草缓肝之急；火运不及之年，心气不足，治当补心温阳，用桂、附温心之阳。张元素还按照六气主病分类，创立了“六气方治”体系：风治法、暑治法、湿治法、燥治法、寒治法、火治法，各列代表方剂，使运气与临床用药之间的桥梁得以建立。",
      "classics_quote": "「运气为病之源，脏腑受病之应。故察运气则知病之所从来，察脏腑则知病之所从去。知其源而治其流，不若知其源而治其源也。」——张元素《医学启源》",
      "clinical_significance": "张元素将运气学说与脏腑辨证结合，使运气理论具有了直接的临床操作性。其“脏腑标本药式”成为后世脏腑辨证用药的范本。李东垣的补土学说、王好古的阴证论均受其影响。临床运用时，先推算岁运格局，再结合脏腑辨证确定病位，两者互参可提高辨证准确性。",
      "related_yunqi_keys": [
        "zangfu_bianzheng",
        "yunqi_bingji",
        "wuyun_taiguo_buji",
        "zangfu_biaoben_yaoshi",
        "liuqi_fangzhi"
      ]
    },
    {
      "commentary_id": "commentary_6",
      "rag_key": "zhang_yuansu_yinjing_baoshi",
      "author": "张元素",
      "dynasty": "金代",
      "work": "《医学启源》《洁古珍珠囊》",
      "chapter": "引经报使",
      "core_theory_title": "引经报使理论",
      "core_theory": "张元素的“引经报使”理论是运气学说在方剂配伍中的创新应用。该理论的核心思想是：每一味药物除具有常规功效外，还具有“引导”作用——引导其他药物的药力到达特定的经脉脏腑。张元素根据《素问》五运六气理论，结合脏腑经络学说，系统归纳了各经引经药。具体而言：太阳经用羌活、藁本；阳明经用白芷、升麻；少阳经用柴胡；太阴经用苍术、白芍；少阴经用独活、细辛；厥阴经用川芎、青皮。更精妙的是，张元素提出按运气年辰选用引经药的原则：木运太过之年（壬年），厥阴风木偏盛，引经药当以泻肝为主，重用白芍、青皮；火运太过之年（戊年），少阴君火偏盛，引经药当以泻心为主，重用黄连、黄芩。这种将运气年辰与引经药选择相结合的用药思路，使方剂配伍具有“时”与“位”的双重针对性。",
      "classics_quote": "「夫药之引经，如人之向导，不惟引诸药至于病所，亦能引药至于其时也。故用药须知引经报使之法。」——张元素《洁古珍珠囊》",
      "clinical_significance": "引经报使理论是中药方剂配伍学的重要里程碑，使“方从法出、法随证立”走向更加精细化的“药有位向、方有归经”。后世医家在治疗头痛时按部位分经用药（太阳头痛用羌活、阳明头痛用白芷、少阳头痛用柴胡），即源于此。结合运气年辰选用引经药，体现了时间医学与经络辨证的深度融合。",
      "related_yunqi_keys": [
        "yinjing_yao",
        "zangfu_bianzheng",
        "wuyun_taiguo_buji",
        "liujing_bianzheng",
        "fangji_peiwu"
      ]
    },
    {
      "commentary_id": "commentary_7",
      "rag_key": "li_dongyuan_piwei_yunqi",
      "author": "李东垣",
      "dynasty": "金代",
      "work": "《脾胃论》《内外伤辨惑论》",
      "chapter": "脾胃虚实传变论、天地阴阳生杀之理在升降浮沉之间论",
      "core_theory_title": "脾胃与运气——补土学派对运气学说的发挥",
      "core_theory": "李东垣（1180-1251年），金元四大家之一，补土学派创始人，师从张元素。他在《脾胃论》中将运气学说与脾胃理论深度融合，提出“内伤脾胃，百病由生”的著名论断。李东垣从运气升降角度论证了脾胃在人体气机中的核心地位：脾为太阴湿土，属阴中之至阴，主运化升清；胃为阳明燥金，属阳中之阳，主受纳降浊。脾胃位居中焦，是天地之气升降出入的枢纽。李东垣指出，运气变化对脾胃的影响最为直接——岁土太过则脾湿偏盛，岁木太过则肝木乘土，岁火太过则胃热偏盛。他特别强调“火与元气不两立”的观点：五运火气偏盛（或劳倦内伤导致阴火升腾），则元气受伤，脾胃功能受损。李东垣据此创立了以补中益气汤为代表的补脾升阳系列方剂，将运气升降理论转化为脾胃病的具体治法。这种“补土”思想的诞生，使运气学说从推算气候转向了调理人体内在气机。",
      "classics_quote": "「夫脾胃不足，皆为血病，是阳气不足，阴气有余。故九窍不通，皆属胃气虚弱也。……天地阴阳生杀之理在升降浮沉之间，脾胃之气不升则九窍为之不利。」——李东垣《脾胃论》",
      "clinical_significance": "李东垣的脾胃运气理论对后世影响巨大，补中益气汤、升阳益胃汤、调中益气汤等至今广泛应用于气虚发热、内脏下垂、慢性腹泻、免疫力低下等证。其“甘温除大热”法开创了内伤发热治疗新途径。临床运用运气理论时，需着重考虑脾胃中气的盛衰在疾病传变中的关键作用。",
      "related_yunqi_keys": [
        "piwei_lun",
        "buzhong_yiqi",
        "shengqing_jiangzhuo",
        "sheng_yang_yi_wei",
        "taiyin_shitu",
        "huo_yu_yuanqi_buliangli"
      ]
    },
    {
      "commentary_id": "commentary_8",
      "rag_key": "li_dongyuan_shengyang_yiwei",
      "author": "李东垣",
      "dynasty": "金代",
      "work": "《脾胃论》《兰室秘藏》",
      "chapter": "升阳益胃汤论",
      "core_theory_title": "升阳益胃法——运气升降理论在脾胃病中的应用",
      "core_theory": "李东垣在《脾胃论》中基于运气升降理论，创立了“升阳益胃”的治疗大法。其理论核心是：脾胃气虚则清阳不升，浊阴不降，九窍不利，诸病由生。李东垣认为运气变化中的“春升、夏浮、秋降、冬沉”规律与人体脾胃气机相应——脾胃阳气当升而反降则病，当降而反升亦病。升阳益胃法的代表方升阳益胃汤，正是针对脾胃气虚兼有湿热之证而设。方中以黄芪、人参、白术、甘草补脾益气为君；以羌活、独活、防风、柴胡升举清阳为臣，此正是张元素引经报使法的运用——羌活走太阳、柴胡走少阳、防风走厥阴，三经阳气升则清气得以上奉；佐以半夏、陈皮理气降浊，茯苓、泽泻利湿清热，黄连清解郁热；使以白芍敛阴和营。全方体现了“升降并举、补泻兼施”的组方思想，是运气升降理论在方剂中的完美体现。升阳益胃汤又可按年辰加减：木运太过加白芍以柔肝，火运太过加黄连以清心，土运太过加苍术以燥湿。",
      "classics_quote": "「脾既虚则清阳不升，浊阴不降，九窍为之不利。当先助元气，以升阳益胃，以甘温之药主之。」——李东垣《脾胃论·升阳益胃汤论》",
      "clinical_significance": "升阳益胃汤是李东垣补土学派的代表方之一，广泛用于慢性胃炎、胃下垂、慢性腹泻、慢性疲劳综合征、自身免疫性疾病等属脾虚湿困、清阳不升者。方中羌活、独活、防风等风药的运用，体现了“风能胜湿”的运气理论。按年辰加减法则使此方具有时间个性化特征。",
      "related_yunqi_keys": [
        "shengyang_yiwei_tang",
        "piwei_lun",
        "shengqing_jiangzhuo",
        "feng_neng_shengshi",
        "yongyao_jiajian"
      ]
    },
    {
      "commentary_id": "commentary_9",
      "rag_key": "wang_shishan_yunqi_yilan",
      "author": "汪石山",
      "dynasty": "明代",
      "work": "《运气易览》",
      "chapter": "平气论、运气说",
      "core_theory_title": "平气论——简化运气推算",
      "core_theory": "汪石山（1463-1539年），明代著名医家，精研运气学说三十余年。他在《运气易览》中系统整理并简化了五运六气的推算方法，其中最突出的贡献是“平气”理论的系统化阐述。汪石山指出，运气推算虽以天干化五运、地支化六气为基本法则，但实际气候并非机械地对应干支配属，常因司天、在泉、胜复等因素的调节而出现“既非太过亦非不及”的平气状态。他总结出平气产生的三种情况：其一，岁运太过而司天之气克之（如壬年木运太过，若司天为阳明燥金，金克木则太过被抑，化为平气）；其二，岁运不及而司天之气生之或同气（如丁年木运不及，若司天为厥阴风木，同气相求则不及得助，化为平气）；其三，岁运既无太过亦无不及之象，自然为平气。汪石山还绘制了“平气图”，详列各年平气之判断标准，使医家不必繁琐推算即可快速判断当年运气格局。",
      "classics_quote": "「运气之说，太过不及平气三者而已。太过者抑之，不及者扶之，平气者和之。此圣人治运气之大法也。」——汪石山《运气易览·平气论》",
      "clinical_significance": "汪石山的平气理论降低了运气推算的临床门槛，使医家不必精通复杂的天文历算即可应用运气理论。平气之年气候平和，疾病以宿疾为主，新感较少；太过之年当预抑其胜气；不及之年当预扶其弱脏。这种“治未病”思想对高发病的时间预测和预防性用药具有重要指导价值。",
      "related_yunqi_keys": [
        "pingqi",
        "yunqi_tuisuan",
        "sitian_yazhi",
        "taiguo_buji",
        "zhibing_yuanze"
      ]
    },
    {
      "commentary_id": "commentary_10",
      "rag_key": "wang_shishan_zhiqi_xinshuo",
      "author": "汪石山",
      "dynasty": "明代",
      "work": "《运气易览》",
      "chapter": "五运化生论",
      "core_theory_title": "支干相合化运新说",